benefitsReview,binary_sentiment
"Clearing of sinus infection and bronchitis.  Used a few times for same problem, sometimes after trial of azythromicin (which did nothing) or doxycycline which  also did very little.",positive
The treatment benefits were that my cholestrol levels went from 9 to the 4-5 level.  This was demonstrated by regular blood test results.,positive
"i have had eustachian tube pain in my neck for about 2 years most days, and almost everyday this last year.  this is the only thing that has ever worked to relieve the pain, and as a benefit it helped with some mild allergies.  LOVE IT",positive
Was to prevent thinning of bones,negative
"Eliminated physical craving for alcohol. Relaxing. Reduced anxiety. Lowered blood presssure and heart rate.
I had been unable to taper off or quit drinking alcohol for over 3 years, and drinking was affecting my work and home life. I was frightened of the severe anxiety when I would try to stop drinking. Working with my PCP we agreed on this threatment, which worked.",positive
depression was alleviated to a functional degree.I wasn't in lala land but was able to get out of bed and care for my children. I was never suicidal or violent,positive
"I have suffered from acne for 10+ years, and let me tell you, Accutane is the only thing that's worked for me.  Improvement in skin in days... clear skin in a couple weeks.  I have tried almost every treatment out there, and no results have compared to those I got from using Accutane.  Take it from someone who's suffered a long time: try it and you won't be sorry.  Be wary of some of the possible side effects, though.  I didn't experience anything too drastic, but everyone's different.",positive
"I had very stron earache, which made me unable to work. High-dose Aspirin did not help, nor did Paracetamol. However, Ibuprofen worked perfectly: my pain was letely compgone as long as the tablet taken twas effective. Only about half an hour before I was allowed to take the next tablet did my earache start again. I was very happy!!",positive
"Initially, Lexapro helped alleviate some of the stress I was experiencing. I noticed that situations that would normally aggravate me (i.e. stress of work, children, college assignments,etc.) I was able to handle better.",negative
"I had a complete hysterectomy at age 52 and started HRT to avoid the immediate menapause which occurred right after surgery. Unfortunately the hospital staff put me on the estrogen patch which did not work and I was miserable the first couple of nights with severe hot flashes and poor sleep waking up often with soaked clothes and the sensation of itching everywhere during the day. Once my GYN doc changed me over to Premarin .625mg everything adverse disappeared and I enjoyed no menapausal hot flashes,mood swings, loss of sleep, vaginal dryness and my skin benefited as well, no lines or wrinkles and good elasticity.",positive
"It alleviated my Gastroesophageal Reflux Disease(Gerd)symptoms as long as I took the medicine as prescribed by the doctor,one capsule, once a day.",positive
I regained my hearing after a virus caused sudden sensorineural hearing loss in my left ear by taking Prednisone.,positive
"After taking Altase, then Lisinopril, began Diovan, first 80 MG, then 160. The ""ACE"" cough disappeared with the 80 MG almost immediately. However morning surge BP continued.",negative
No change in acne despite 15 days of usage -- probably antibiotic resistant.,negative
"Completely took away my severe chronic body pain. I was able to sleep at night and was not fatigued during the day. You have to be very careful with the dosage and slowly increase it, but it is completely worth it.",positive
the patient felt good. he was relieved of his symptoms. he felt les tired may be becuse of reassurance.the asirin tablets are known in india as blod thinner. the drug is gven to patiets even at a doubt of heart condition.the diazepal is a mild sedative without much sie effects this is proved a good drug for over anxious patients.,positive
"Topamax greatly reduced severe migraines that were occurring almost daily and it  seemed to greatly lessen the hypersensitivity of my brain to overreact to triggers that caused my migraines(stress, changes in barometric pressure,certain food,smells,noise, and light),stabled moods,reduced irritability, increased weight loss(40lb).",positive
quick weightloss,negative
quick weight loss,positive
"If used regularly, this treatment eliminates the white and rough spots my daughter gets all over her arms and hands (and in some cases, her legs).",positive
Quit smoking in 90 days,positive
Almost completely Stopped seizures,positive
"Definite improvement in mood, particularly at the beginning of treatment. Much better stability with moods and PMS symptoms in particular. I do think that I don't feel it is as effective now as when I started but still feel better than without it and would not stop treatment.",positive
"Venlafaxine is a bicyclic antidepressant, and is usually categorized as a serotonin-norepinephrine reuptake inhibitor (SNRI), but it has been referred to as a serotonin-norepinephrine-dopamine reuptake inhibitor. It works by blocking the transporter ""reuptake"" proteins for key neurotransmitters affecting mood, thereby leaving more active neurotransmitters in the synapse. The neurotransmitters affected are serotonin (5-hydroxytryptamine) and norepinephrine (noradrenaline). Additionally, in high doses it weakly inhibits the reuptake of dopamine, with recent evidence showing that the norepinephrine transporter also transports some dopamine as well, implying that SNRIs may also increase dopamine transmission. This is because SNRIs work by inhibiting reuptake, i.e. preventing the serotonin and norepinephrine transporters from taking their respective neurotransmitters back to their storage vesicles for later use. If the norepinephrine transporter normally recycles some dopamine too, then SNRIs will also enhance dopaminergic transmission. Therefore, the antidepressant effects associated with increasing norepinephrine levels may also be partly or largely due to the concurrent increase in dopamine (particularly in the prefrontal cortex).",positive
"I have had SVT's all my life.  It was only when I turned 24 that I sought treatment for them as they usually were linked with a syncope episode.  I was originally put on the grandfather of beta/alpha blockers inderal.  While this drug was effective at treating my migraines, it was not particularly effective at controlling my palpitations and it tended to lower my blood pressure too much.  I always felt tired and had little energy on this drug.  At 24 years of age I was not happy to have the energy of a 65 year-old.  Next came atenolol and labatolol (when I was pregnant).  I also had break-through palpitations with these drugs as well as low-enegy side effects.  With labetolol I could barely jog down my street without becoming significantly winded and according to my cardiologist I fell into the 94th percentile for ""in-shape"" people my age.  Finally, when bystolic hit the market I was thrilled.  First of all I didn't need a large dose of it to be effective.  Second, it was effective.  I experience no break-through palpitations, and last but not least there were very few to no side effects.  I had energy again and I could get throught my cardiovascular exercise without becoming winded.",positive
"improvement in daytime wakefulness without the ""peaks and valleys"" previously experienced taking prescription Ritalin for this condition. There's no excessive nervousness or feeling like I'm taking speed.  I just don't feel like I'm going to fall asleep.",positive
Mirtazapine was very effective in treating chronic insomnia. I was not sleeping due to severe anxiety and moderate depression. The drug has significantly improved anxiety symptoms and is gradually lifting mood and reducing depression symptoms,positive
"With OAB there was the urge to urinate frequently which felt like a constant mild bladder infection.  There was some relief after a couple of days on this drug. However, some days I felt as poorly as I did without them.  But after approximately 8 weeks almost all of the discomfort was gone.  I feel pretty normal.  One key to making this work is to deliberately not urinate too often.  I have noticed that now I sometimes need to remind myself to go.  I probably feel the urge less than I did before I had this problem.",positive
prevacid kept me from from having acid reflux.. Have been taking this drug for about 4 years..,positive
"I find that this drug effectively eliminates symptoms of restless leg syndrome.  When having to sit in one position for extended periods (long air flights, car trips, meetings,) I experience great discomfort and an almost uncontrollable need to move my legs.  This drug eliminates all discomfort and compulsion to move.  It's terrific!",positive
to reduce headache,positive
"Before taking Lexapro I had severe anxiety attacks, by myself, when i would cry uncontrolably for about 30 mins each night. I would also have random panick attacks in public, triggerd by fealings of self conciesness, insecurity and confusion. After taking the medication, these problems were aliviated.",positive
"some clearing of acne but not completely. re-occurrence still happened. Scarring was still there. Overall, did not feel that effectiveness was best. Possibly a more natural cure would have been better.",positive
"Reduced incidence of cyctic acne.  Supposed anti-aging/reduced wrinkles are widely published.  I can't confirm these benefits, as I treated my whole face and don't know what it would have looked like without treatment.",positive
took the reglan to try to empty my stomach before i threw up and the reglan didnt work  -  the tagamet helped - scale 1-10 a 10,negative
none,negative
"Stops acid reflux back into esophagus causes by eating, stooping, bending or even sitting in a position that pushes the stomach up, or just from eating even if standing.  Prevents burns to esophagus that can lead to esophageal cancer and ongoing pain.",positive
"Lyrica reduced the pain associated with my anklosing spondylytis when other therapies had failed.  I had tingling, numbness, pain, and very limited movement in my arms and legs from A.S. after developing 6 moderate sized bone spurs on my cervical spine.  It was severely limiting my ability to have any sort of life.  I have tried almost every form of pain killer from OTC to narcotics with very limited effects.  Lyrica works differently and I find that I can be RELATIVELY pain free.  It does not totally eliminate the pain but what it does is make it bearable so that I can function.  I could take more of it according to my doctor but I am more comfortable taking the lowest possible dose.  I've noticed that I have no more tingling, very little numbness, and a greatly expanded range of motion without pain.  I highly recommend this drug!",positive
No longer fell asleep at inappropriate and dangerous times. For the first time in my adult life I was able to concentrate. I was able to effectively work and study.,positive
Completely cleared up my acne b/4 my wedding.,positive
"I did eventually fall asleep but it took a while (was told it only takes 20-30 min. but ended up being a couple hours, I read and eventually fall asleep and then the quality of sleep was poor; I just toss and turn all night I have 23 left I'll keep taking till gone, maybe they will improve over time.",negative
"The drug stopped my menstrual periods and put me into artificial menopause.  The hope was that it would trigger my body to go into menpause and stop the heavy bleeding associated with my fibroids.  Unfortunately, my period came back approximately 2 months after the last injection",positive
"I have been able to maintain sobriety and get my life back on track.  Methadone has allowed me to get my ""bearings"" underneath me, and really focus on what is important in life once again. After about 6 months, I began working and have been promoted consistently since then.  I am currently tapering and am really trying to be smart about it.  While I am very eager to be off methadone, I also do not want to rush it.  I feel that methadone should be one of the last options a person looks to when trying to stop opiate use because it isn't something that can be stopped whenever a person feels ready.  I have found it to be quite a complex task.",positive
"I am less angry, sleep a little better, MUCH less anxious. I am able to play with the kids without unhappily obsessing over all the things I should be working on. I can just chill out and be in the moment.",positive
Elimated restless feeling and able to sleep at night. The main thing is that I do not go off the deep end when something goes wrong or that I do not control. I also had the side / added benefit of dropping fifteen pounds within the first two monhts of starting medication which also naturally makes you feel better as well.,positive
"this drug helped the swelling i had in my mouth from an infected area above my wisdom tooth. it didn't help with the pain, i had to take another prescription drug to get all of the swelling and pain to a bearable level. the",positive
mild pain reduction in arm/wrist,negative
"I had migraines everyday, this slowly worked it up to where i'd only get a mild migraine once maybe twice a week at most.",positive
"make me worry less, and did make me feel better about life in general. it made my mood switch from being completely depressed and miserable to happy.",positive
"The benefits allowed me to physically calm.  this allowed me to sleep better, eat less and encourage a better outlook. Without Tramal life was very down.",positive
"My headaches have been considerably reduced; however, I still experience some mild headaches. The relief from my chronic and debilitating headaches has been a miracle thus far, and while I've had some pretty irritating side effects, I'm willing to put up with them so that I can live my life relatively pain free. I'm hoping the pain will pass.",positive
allergies were completely cleared up while on the medication.,positive
Pustules disappeared and the redness diminished,positive
"IT decreased mildly elevated Prolactin immediately from 25 units to 10 units. (mg/l ?)
It also increased my sex drive, but this stopped after a while. 

It also moderately decreased Psoriatic Arthritis pains and also symptoms in nails and joints, but needed to be taken very regular for this.. Forgetting to take it twice a week already made it work less effective.

(Cabergoline was more effective, had less side effects- but potentially has side effects on heart valve, so one needs to be very careful with it. )",positive
"Diminished hot flushes, mood swings, anxiety, skin plumped out and wrinkles decreased, depression lessened, concentration and memory and focus improved.",positive
"It did lower my cholesterol slightly, but that may have also been du to a change in my diet.",negative
"IT WAS supposed to help after major dental surgery?  I HAD ALL MY UPPER TEETH EXTRACTED, AND 4 TEETH EXTRACTED FROM MY LOWER TEETH.  I HAD ROOT PLANING DONE ON BOTH UPPER AND LOWER MOUTH. SURGERY WAS DONE WITH TWILIGHT SLEEP ON AN OUT PATIENT BASIS.  I HAVE A BEAUTIFUL MOUTH NOW AND EVEN MY GUM DISEASE IS IMPROVING,",negative
"I waited about 12 hours after surgery - till incision began to hurt - before I took the drug. It might have been move effective if I had taken it before pain started. As it was, it took about two hours to get relief.",negative
it makes me not nervous and i think it helps with depression also,positive
"balancing of thyroid back to normal range. Prior to treatment, patient had some mental confusion, weight gain, needed extreme amounts of sleep.  With treatment, mental acuity was obtained, weight stablized, energy increased. At one time treatment was discontinued for one month by MD to ensure that the thyroid gland was not producing adequate amounts of thyroid. Patient was put back on treatment after blood tests confirmed levels in bloodstream.  This treatment has made a positive difference in patients life.",positive
"Almost complete removal of all existing and future acne. I took this drug with meals and could not be happier. Accutane changed the whole composition of my skin, changing me from very oily to normal/dehydrated in just over two weeks. The remainder of the dosage resulted in secureing my clarity and allowing my skin to look and feel better.",positive
"Maintained a general feeling of well being and being able to cope with life. When I stopped the treatment (gradually) the depression returned after a couple of months. Having suffered from depression periodically over a number of years, I feel my quality of life has increased with Prozac.",positive
"Depression lifted, more energy, more focus, more productive at work and school, able to laugh and smile, still felt sad or upset sometime (which is good because it means I didn't feel numb like some anti-depressants make you feel, sleep better.",positive
"I was suffering from mild back pain for a sports injury and also insomnia.  Not only was my back pain temporarily eliviated, I got uninterrupted sleep while I was taking this medication.  Before then, I hadn't slept for almost a week straight.  It was very important that I allowed at least eight hours of sleep.  I made the mistake a couple of times of taking it when I wasn't going to get a full nights sleep and ended up severely drowsy and unalert.  On those two occasions, I ""made-up"" for the missed hours of sleep and over slept.  This did not help, as it furthered my sleepiness.  I sort of had to get on a schedule again.  

When taken properly, it can be very helpful.",positive
"reduced nausea from continual to episodic, feeling of fullness decreased",positive
"Prozac makes me feel just stabilized not really ""Happy"",it really just levels me out so i can cope with everyday life and the stresses involved. It was one of the better medications i have tried and have tried several over the past few years that really did nothing. Seroquel was also prescribed for sleeping . I took that in combination with the clonazepam",positive
"reduction of hot flashes, and reduction of vaginal dryness. I'd already been trying a vaginal estrogen ring, but this wasn't enough of a dose for me, apparently. Since taking out the ring, which I'd had in for 6 months, and using the cream instead, things have been a lot better (i.e. less dryness, and less pain with intercourse. Yay!",positive
None.  This product as all prescription and nonprecriptions products that are available in the USA have offered no relief whatsoever from the flushing of Rosacea and extremely sensitive skin.,negative
"Effexor was prescribed to alleviate hot flashes, and to help me sleep through the night.",positive
"Candida rashes did not disappear. I was doing an anti-candida diet at the same time. i.e cutting out sugars, refined carbs etc. and taking oregano oil, probiotics, pau d'arco tea, caprylic acid. Cream did not work any better than ti tree oil.",negative
Lunesta definitely put me to sleep and kept me asleep until morning.,positive
"I didn't feel my joint pain after taking this, I think because I was too bothered by the side effects.",negative
My cystic acne was reduced. My face did clear up consistently with the help of the pills and creams such as retin-a.,positive
Made the patient feel normal pretty much.,positive
"After 6 weeks of taking 10 mg  of Prozac, physical anxiety symptoms  dramatically dimished. Now, 6 months after beginning treatment, my blood pressure has also fallen. With BP medication alone, my BP hovered around 135/85. Couple with Prozac, my blood pressure is consistantly in the 110-120 over 80-80 range. I also experience very little panic attacks ( I used to have several a day). When I do experience one, I have been able to self talk myself down from it.",positive
leveled out emotional highs and lows,positive
"Reduced swelling and pain after about two days.  Then on the third day, started to get stomach cramps that settled into lower right abdomen.  Initial injection on Monday night, cramps by Thursday noon, emergency room Thursday night, appendix removed Saturday morning.",negative
"Minimal, if any.",negative
to eliminate sores on stump and siezures,positive
"I am sleeping more deeply, especially during the first four or five hours after falling asleep.  I still have hot flashes during those hours, however I seem to be in a deeper state of sleep and during those hours I usually don't fully awake during the hot flash, as I used to do.  I used to be almost fully awake every time I experienced a hot flash (every 1 to 1.5 hours).  Now I get a few hours of fairly good sleep at the beginning of my sleep cycle.",positive
"This drug reduced inflammation in the nasal passages, successfully treated hay-fever type symptoms, and also helped with hoarseness probably due to the fact that it cleared up post nasal drip.  I like to sing and I found I could sing longer without getting hoarse.",positive
"Helped to promote sleep without side effects, hangover or any of the other problems associated with other sleep medications.  The sleep difficulty was caused by a horrible reaction to another medication called Celexa, which appeared to sensitize my nervous system even after the Celexa was stopped.  Ever since taking the Celexa my nervous system has been exquisitely sensitive, with symptoms such as pain, heart palpitations, restless legs, and other such things that totally interrupted my ability to fall asleep and stay asleep.",positive
I had inflammation in my ribs due to severe coughing from bronchitis.  Doc told me to only take tramadol in cases where the pain was severe and not to mix with my muscle relaxer (flexeril).  Tramadol did do a decent job of taking away the pain and helping me sleep.,negative
no problems with either meds,positive
Very effective at eliminating pain.,positive
Cleared my acne after 2 months with sporadic breakout but not as severe before starting regiment. Wrinkles reduced and cleared scarring as well. My skin texture improved dramatically. Hyperpigmentation disappeared and skin seems to be resilient to wrinkles.,positive
Successful management of post-op pain following reconstructive foot surgery including osteotomy with split tendon transfer.,negative
"feeling really relieved from the effects of usual depression, that i had for more than 10 years : feeling very low, no energy, daily crying, fear from future, unhappiness and underestimation of myself, regular temptation of suicide, thought i never tried to kill myself, the idea was becoming an obsession. And this terrible feeling of pretending all the time, at work, with friends, that i was ok, had disappeared. 
Before getting pregnant, i was a bit afraid that i have to stop the medication by my doctor told me to go on, that there was no known side effect with pregnancy, so i went on. My son is now 14 months old and is a wonderful healthy little boy, with a happy mother !",positive
The Zydol was effective in reducing my pain after the dose was increased from 50 mg to 100 mg.  The Diazepam made me sleep all the time which was a good thing as I believe the body heals while sleeping,negative
"some reduced frequency in urination. didn't seem to reduce urgency 
a;lkjd ajalkd; adlfjsldj safljslfk fdsakjs sfdlkjsl salfjsdl sdfljlksd lksdafkj;s saldfjslk sdfkslfkj sdflkjslk",negative
the bacterial infection was treated effectively.,negative
There was no benefit for either my neuropathic pain or migraine headaches.,negative
"Helped reduce nasal discomforts from seasonal allergies.  I had reduced nasal drainage, less sneezing and less eye irritation.",positive
It did help dull my foot pain.,positive
It did get rid of my headache.,negative
Help me sleep 6 hours,positive
"I experienced nearly immediate decreased acne, without any of the dreaded sun sensitivity. It decrease papuless, whiteheads and blackheads all similarly. The medicine took effect almost immediately. I was not aware was supposed to take on empty stomach and yet still effective.",positive
"A reduction of inflamation in the joints on the hands, feet and elbow.  The nature of taking one does per week was also very beneficial did not have to remember to take daily.",positive
My skin was really red (I am very fair skinned) from using harsh products (Obagi) and benzyol peroxide. The redness started to improve within the first week. I just used a mild cleanser and the differin. I had less whiteheads the first two weeks as well but then had a purging period for a couple of weeks. My skin is defininately clearer now but not perfect. Did not help at all with oily skin.,positive
"Became addictive .. Docs never told anything that it should only be used very short term, less then two weeks!  The then become addictive. Not only that, the told me nothing of side affects, nor tolerance withdrawals, nor, you need to withdraw slowly.  These are very dangerous drugs, you my think it helps, but you will pay he'll being on any  benzodizapines.  If you don,t believe this, go towww.benzo.org read dr (prof) ashton,s Manuel.   You will suffer the depth of he'll if you don,t get off these.  .",negative
Lower my blood pressure out of the Prehypertension range,negative
"I am not sure if it was levothyroxine that helped to normalise the hormone levels. It's kind of strange, as they've only were back in range, when i stopped taking l-thyroxine.",negative
This pill is awesome!,positive
Helped to alleviate allergic reactions to the environmental allergy agents.,positive
