benefitsReview,binary_sentiment
"slowed the progression of left ventricular dysfunction into overt heart failure 
alone or with other agents in the managment of hypertension 
mangagement of congestive heart failur",negative
"Although this type of birth control has more cons than pros, it did help with my cramps. It's also effective with the prevention of pregnancy. (Along with use of condoms as well)",negative
"I was used to having cramps so badly that they would leave me balled up in bed for at least 2 days.  The Ponstel doesn't take the pain away completely, but takes the edge off so much that normal activities were possible. Definitely a miracle medication!!",positive
"The acid reflux went away for a few months after just a few days of being on the drug. The heartburn started again as soon as I stopped taking it. So I began treatment again. 6 months passed and I stopped taking it. The heartburn came back, and seemed worse even. The doctor said I should try another 6 month treatment. I did, and the same exact thing happened. This went on for about three years. I asked why this wasn't curing my reflux. The doctor quite frankly told me that it wasn't a cure, but a ""treatment for the symptoms"". I was told that I would probably be on it for the rest of my life.",negative
"I think that the Lyrica was starting to help with the pain, but the side-effects were just too severe to continue.",negative
"after taking propecia for over a year, starting when i was 20 years of age my hair continued to thin, and i noticed no significant benefits",negative
"My mood has noticably improved, I have more energy, experience better sleep and digestion.",positive
"Although this drug was originally prescribed for depression, it helped with sleeplessness. Therefore, I have continued to take it for that alone. While I still on occasion have problems falling asleep, I find I can combine it with Melatonin or Valerian. In 12 years, I haven't had to increase the elavil dosage.",positive
"This simply just works fast and without any of the nasty side effects of SSRI medicines. I won't go into a long story of my panic attacks which I sought help for many years after the fact. This just works and it does what it's supposed to without any annoying side effects. When taken daily, it has stopped my panic attacks from starting and thinking patterns that lead to them. I find it can also be used as needed along with the daily treatment.",positive
"none - did nothing to help allergies. i just had a dryer, more painful version of my allergies with new allergies/irritations developing on top of my original ones. this stuff is dangerous and the side effects that many people are experiencing are not listed on the package. a class action lawsuit needs to happen.",negative
I experienced complete clearing of the Vaginosis after the regimin was completed.,positive
"Smoother more gradual onset and effect than Adderall. Effective at controlling ADD symptoms previously controlled by Adderall however this drug seems more natural and transparent. Less tension and anxiety. Less ""druggy"" unnatural feelings and thoughts.",positive
I found that this drug helps significantly with my level of depression and monthly irritability that occurs around my menstrual cycles.,positive
"For the first time in my life I had enough lashes to apply mascara to.  I had tried eyelash extensions which only broke off or pulled out what few thin lashes I did have.  Strip lashes were itchy and uncomfortable.  I now have normal lashes.
Even though I only applied it to upper lashes the lower lashes have grown longer and thicker too.",positive
Aldara did seem to crust up my previous skin cancer area and help minimize my scar from MOHS surgery for skin cancer. Due to the side effects I could only tolerate for one week opposed to 6 week regiman.,negative
"reduction in anxiety, no panic attacks.  drug is extremely effective",positive
"I'm taking Gabapentin to treat nerve disorder. My nerves are inflamed and causes to experience pelvic pain and other pelvic disorders. The Gabapentin sometimes works but I do experience relapse.

For the migraines
I find that the 800mg of Ibprofen works better with no side effect for my migraines, but the maxalt has a better track record.",positive
don't know yet back to pediatrician today,negative
Very good at relieving anxiety.  Good at generally calming me down and 'leveling me out' to make functioning easier.  Helps a little to relax muscle tension.  Calming effect makes an excellent sleep aid.,positive
"Controlled the psoriasis, however did not reduce its presence.",positive
cure the ezcema and it took aout teh roughest of the skin,positive
reduction of panic attacks and depression to almost nil,positive
"I took isotretinoin for persistent adult acne.  My skin was not by any means awful, but I did have evident pimples on my forehead and chin, and awful, awful blackheads on my nose that despite daily steaming and extraction, were terrible.  The drug totally cleared up my face, and my blackhead literally dried up in front of my eyes.  My once horribly oily skin changed to almost normal.",positive
"The treatment benefits included Skin Regeneration, and decreased Acne.  My skin felt more smooth and the pigmentation was disapearing.  Overall, the goals were accomplished however the redness of the skin took over.",positive
fits settled down to maybe 1 a fortnight which were daily before this medication,positive
Reduce number of MS relapses,positive
"I had taken Pulmicort, and other inhalants, with no major changes.  It became more difficult to maintain my exercise and lively life style. I gave in and began Symbicort and immediately experienced a relief of shortness of breath, weezing.  I feel like a new person. I still have a reaction to cold wind, and very high humidity, but so much better.  I rarely use my Albuterol.",positive
I'm feeling more grounded; highs and lows are less extreme.  You could say that my emotional 'playing field' is more level.,positive
"It seemed to work at first, but then the side effects started. Fatigue, severe memory loss, poor decisions, urinary incontinence, personality changes (crabby, irritable, withdrawn). The hard part is I can't seem to get off this stuff!! The withdrawals are horrible, shakiness, feelings of doom, loss of appetite, nausea, palpitations. It scares me so much that I just start taking it again. I'm stuck!! Don't ever start this stuff, there is something wrong with it. I don't know if I will ever be myself again.",negative
decrease in acne pustules,positive
"Alert, awake, focused",positive
My  bone density's results have always been stable and I was told to continue with the drug.,positive
"I was more alert during the first part of the day but I found that it wore off by the afternoon. I could focus clearly, and if I needed a boost during the day another dose was enough.",positive
Sleeping 7-8 hours without hangover,positive
"I have taken antidepressants for many years, and this is first that did not ""flip the switch"" on sexuality.  I no longer feel like I am looking out of a dark room.  I have more energy, feel more motivated, and overall function at a higher level than before.",positive
"Ostensibly this will halt or even reverse the effects of male-pattern baldness. So far, one month in, there is not a great deal to report. I expected my hair loss to temporarily increase, as I had read in the literature that as dormant hair follicles reactivate, they push dead hairs out in order to form new ones. In other word, hair in a dead follicle will linger for a few months, and reactivation of the follicle will push out the old hair to make room for the new. So far, this has not occurred. The product must be taken for up to two years for any noticeable hair growth to take place, so I really haven't been on it long enough to judge its re-growth potential. In terms of halting the process, however, I must say there are fewer hairs in my brush each morning, so it's possible the drug is having an effect already. I will post a fuller report in another forty-seven months, I suppose.",positive
I have A-typical migraines which gives me weird sensation in my ears such as roaring and the sense that they are vibrating.  I also do have headacheds that seem to come from ears and the back of my neck.  It help me feel better and started to decrease my symptoms but side effects were worse than original symptoms.  It helped me to ignore my symptoms and helped me to get through the day.,negative
migraine headache would stop,positive
"Assists with getting to sleep and due to longer half life than other anxiolytics(ie Alprazolam)anxiety is less upon waking. Whilst Alprazolam is extrememly effective for immediate reduction in arousal, I find Lorazepam more effective for overall lowering of anxiety.It has been especially helpful to start the day with little or no anxiety rather than with a high arousal level immediately needing management or medication.",positive
"I had   persistent periodontal problems, both stressful and painful.  Every dentist I saw  told me I was going to lose my teeth.  This drug  cleared up the condition.  It protected me against inflammation for the entire period of time that I took it.  I continued taking the drug much longer than is usually recommended because it was so effective. The effectiveness did not seem to diminish.",positive
"relieves depression, helps other things such as sleep, dieting, exercise, relationships, responses to stimulous.  The cost is lower than other antidepressants which can be a help to those on a budget.",positive
"To stop with the migraines, seizures and pain from the fibromyalgia,also have neuropathy in hands and feet from diabetes",positive
The stuff works like a charm--fast and effective.,positive
"The drug was pretty good for pain. They had me on morphine, which was horrible. The pain was preferable to the crazy dreams and paranoia I had. They then tried oxycontin, which was the best pain drug they gave me, but too addictive... so they moved me to vicodin products, which worked pretty well, with surprisingly few side effects.",positive
Effective at controlling seizures without dizziness,positive
Able to tolerate the pain,positive
very effective pain killer,positive
"Eventually Cleared my moderate acne. Had recieved antibiotics etc previosly which reduced it from severe to moderate, but then accutane completely cleared my skin after 5 months",positive
"Brought down my overall cholestorol reading from 218 to 150, LDL from 135 to 90 and triglycerides from 180 to 140 within 3 months time.",positive
"The cream made the basal cell carcinoma and actinic keratoses react, scab up, and heal to nice smooth skin after about two weeks after treatment with the cream ended.",positive
"No undesired pregnancies, lighter period",positive
"I took Minocycline hoping that it would clear up my acne. I have been taking Tetracycline for over 2 years without no result, frustrated, my doctor prescribed Minocyline. After 1 year, I was still having break out just not as bad.",positive
"no menopose benifits are loss off sytoms of menopose. improved mood leval. I have felt more energectic aand as stated a general mood elevation. I have started working out , less irratable and overall calmer. The hormone replacement has improved my lifestyle and relationships to others. I am know longer quick tempered or irritable.",positive
Lost over 30 pounds and still going!,positive
"acne cleared totally,skin became even.",positive
After 2 days of taking the medication my stomach pain subsided.  The burning i also began to go away.  it took a full week for everything to return to normal for mw.,positive
The pressure in my eyes decreased with use over a period of four months.,positive
"Skin in certain areas (e.g. forehead, cheeks) sun damage became less noticeable. Fine lines have slightly improved. However fine lines on the lower eyelids have become worse. It was therefore, not used on fine lines on the lower eyelids the entire 1 year. I have used it approximately 4 months out of the 1 year in this area. It made it crease up and look wrinkled",positive
The med. controlled my seizure disorder.,negative
"Very well managed blood pressure within normal, healthy range.  I had an allergic reaction to a more common blood pressure medication, Lisinopril (which is a combination of a thiazide diuretic and an ACE inhibitor).  The newer Tekturna has worked perfectly for me with only the slightest dizziness when I rose too quickly early on, but no side effects at all after the first few weeks.",positive
"smoother skin,less lines on the face and neck area,collagen in skin is firmer and supple",positive
The drug reduced the frequency of acid reflux events and the associated pain,negative
"Lowered blood pressure.  This was the last prescribed medication for out of control high blood pressure.  Apparently, it takes all three of the medications
to work together. With all of them, my blood pressure is within normal guidelines (or very close), but without any one of them, there is an immediate rise",positive
"After 60 days on Crestor, 5 mg. per day, in combination with changes to my diet, my LDL (bad) cholesterol fell from 180 mg/dL (high risk) to 95 mg/dL (optimal), a drop of nearly half.  My triglyceride levels were reduced as well.",positive
"At the recommendation of the Life Extension foundation, I was taking 1850 mg per day of metformin prophilatically -- as an anti-aging medicine. Gene assay testing by Biomol resveals that metformin surpresses the Sir1 gene, acting as a calorie reduction memetic. Calorie Reduction is the only currently proven way to extend life span, and the hope is that metformin will mimic this. Resveratro ( herb ) also reputably does this.",positive
"It made me feel like my old self again, i was able to go to work and actually get things done and the medication took care of the edgy feeling i had and alot of my tendency to fly off the handle.  The medicine seemed to work great except for a few side effects.",positive
"Before I started on the drug Lexapro, I felt lethargic and didn't want to get out of bed each morning. I hated getting up and facing the day. I would sit and watch the time pass by. Finally, I went to my Dr. for a checkup and he diagnosed me as being depressed. He put me on Wellbutrin and Lexapro 10 mg. I was instructed to take the pill 2 times per day everyday. For the first week I felt disconnected from myself but by the 2nd week I started to feel as if each morning was something to look forward to. I believe that Lexapro was a great addition to my life during my troubled times.",positive
helped aleviate whip lash symptoms,positive
"weight loss, more energy",positive
"i have mild hypothyroidism, so i wasn't necessarily aware of what having an underfunctioning was doing to my body.  still, i was able to detect changes (for the better) after taking synthroid for a few months.  the primary benefit i aw was HIGHLY HIGHLY improved concentration, which has made school/work such a pleasure.  i think my metabloism also improved slightly.",positive
"it decreased my acne but never acne free,less oily skin,",positive
face cleared up conciderably. It took about 2 months for the drug to become conciderably effective though.,positive
"I liked this drug very much, because the stronger doses of antibiotics gave me horrible yeast infections. However, this one didn't quite so much. It still kept my acne at bay, and worked.",positive
Definitely lowered anxiety.,positive
"Reduce a lot the heartburn feeling, and after a week treatment no more heartburn where visible. Every other meal i was taken produced a lot of acid juices in my stomach, after that treatment this never happen.",positive
"The drug has slowed down the process of osteoporosis in my hips.  I feel much better, with less pain than before.  I was very pleased with my checkup when I went to my doctor.  I feel the combination of the Fosamx and the Caltrate Plus
will continue to improve my condition and make my bones stronger.",positive
"Feels like it stops nearly all acid production, heartburn is gone.  Due to cardia weakness stomach contents can still travel up esophagus but no burning sensation is felt.  Regardless there is still some mild irritation in my esophagus.",positive
cold not discern because there was no clinical symptom other than tsh leel was low.the lab test result indicate improvement in tsh level but the doctor did not increase the dosage of the drug.,positive
"My pain and anxiety were considerably lower. I felt like any situation was controllable and I was much more effective at my daily tasks.  The panic attacks, chest pains, and severe worry were almost completely gone. An added benefit was that muscle pain that I always seemed to have was also gone. I rarely had to take any pain meds. It seemed like a miracle.",negative
"I did go to sleep more easily. I'm not sure how effective the time release is, because I often would wake up 4-5 hours later. Sometimes I didn't take it to sleep, but upon waking at 3pm, would take one to go back to sleep. They say to not take unless you have 8 hours to sleep, but this is not the case with me. The cutoff time is 4-5 hours.",positive
Angeliq did eliminate the night sweats and kept the hot flashes to a mininum. I have had severe vaginal dryness (even tearing) and a host of infections (yeast & bacterial). I remain a bit irritated and I have NO sex drive.,positive
"I was able to completely stop a migraine from happening once I felt one starting.  This has been extremely beneficial to me.  I have gotten my life back.  I would have 1-2 migraines a week which would put me in bed for 2 days.  I would take pain killers, which only knocked me out, doing nothing to alleviate the pain.  I was missing a large part of my life, being in bed.  Also I never knew when I would have to cancel plans or stay home from work due to a migraine.  I felt very unreliable, which is not me.  I am a very responsible person.",positive
"Migraine problem: I now only have rare occurance of migraines, less than once a year.  Before Prepro treatment I had a migraines almost continuously, and took Frova at least twice a week. Potential benefits is prevention or delay of osteoporosis, since my mother had severe osteoporsis.",positive
"I sought treatment for two problems in my life: my temper with my daughter and my lack of motivation.  This drug really helped me to control my temper.  In fact, the temper became nonexistent.  I used to yell a lot and stopped completely within two weeks of being on this medication.  However, this was the only benefit I experienced.",positive
"For the first time in my life, I had enough eyelashes to apply mascara to.  I had tried eyelash extensions previously but they only worsened the problem by breaking off or pulling out what skimpy lashes I did have.  After several months of Latisse I have eyelashes and even though I apply it only to upper lashes it has made lower lashes grow too.",positive
"The Wellbutrin with 20 mg of Prozac daily as an adjunct alleviated most symptoms of depression.  Better sleep as a result, and more energy throughout the day.",positive
"Along with the tamiflu, pretty much cleared up any problems I had except for my cough. It was not as bad as a cough, but was still present. It took about 2 days for the medication to actually work but it does a good job.",positive
"nearly instant pain relief , extremely efficace",positive
Hair loss. Helps hair follicles become less sensitive to protestosterone.,positive
My cholesterol was lowered by about 15 points. I did not seem to do anything else nor was it supposed to.,negative
The treatment cured the sore throat for which it was perscribed.,negative
"the treatment benefits for the cream Tazorac were improved skin tone, appearance of reduced wrinkles on forehead, undereye area, upper lip and nose. The skin felt softer and pimples were not prominent.",positive
Increased bone density by 11% first year.,positive
Very good euphoria. More focused in school. Had a very very good feeling in torso area. I forget to eat sometimes and afterwards stomache hurts very  very bad. You do not realize that your hungry.,positive
"It's been only one week and I am seriously amazed at the results. some small spots are invisible and i can see the larger ones fading, my skin already looks more even and balanced and less irritated...after only one week!!! I also love the matte finish it leaves, so you are looking greasy and oily all day. It's hard to believe but I am getting really excited for the results",positive
"I took this medication, Valtrex, upon first experiencing the sensation of tingling and itching symptoms associated with the onset of the beginning of a cold sore/fever blisters (herpes-simplex) outbreak on my face which I had experienced many times before - usually once a year.
The next day after taking valtrex as prescribed, redness of the area affected on my face did develop and a blister did appear to be forming, but the affected area had ceased to itch. 
By the second day, there had been no further development of redness or additional blistering as there would have been in previous times before taking this medication.
On the third day, the redness and initial sign of blister formation had diminshed even further.
By the fifth day after taking this medication, there were no longer any signs or symptoms of what had started out to be, as I had experienced in my previous cold sore outbreaks, a 10 to 12 day spell of uncomfortable and unsightly fever blisters. 
This medication made a real and positive difference for me in the development, disconfort and duration of the symptoms of a cold sore/fever blisters (herpes-simplex) outbreak.",positive
"Do not experience hot flashes, night sweats, mood swings or insomnia due to menopause when using the Femring.",positive
"Well I just wanted to comment or get some incite on this medication. I was just proscribed this medication yesterday took first one before bed as doctor said and woke up this morning feeling like i had drank a case of beer i stumbled getting up out of bed then i felt like i was dying of thirst was just wondering how normal this was? Oh and i was very sleepy and unable to wake up till nearly noon i started to sober up. I have a 3yr old son that i stay home with so i need to be able to function. when i had spoke to my doctor about the problems i was having i told him that i did not want to be on anything strong i had previously been put on Vicodin, oxy-codone and flexeral i hated it i could not take care of my son i could not function im just trying to find a solution for my pain without being messed up.! See back in October of 2009 i fell backwards into a dresser corner while putting my sons clothes up in welkin closet had two possible fractures and two slipped disks was in a neck brace from oct-feb so please let me know if you have any idea what i can do my insurance will not cover physical therapy unfortunately .....",negative
Minimized pain immediatley and made back injury seem non-existant,positive
"My overall cholesterol reduced to just over 4, but not LDL which still remained high within that total. This in my opinion is due to my thyroid condition.",positive
Little if any relief from headache.,negative
"I found for me it was great for pain relief. Also, unlike some of the anti-inflammatory drugs I had taken in the past, I was not drowsy or sluggish during the day and I felt as if I could function normally.",negative
"Chantix did effectively reduce the urge to have a cigarette.  Taken twice per day was most effective, but side effects precluded that dosage for this patient(see below). Chantix was taken in the morning, and patient rarely, if ever, even thought of wanting or 'needing' a cigarette during the day.  In the evening, however, (when the second pill was due to be taken, but wasn't), and especially if patient had an alcoholic beverage, the urge to smoke returned  with a vengence, though a few puffs were all it took to kill the urge.  When patient stopped taking Chantix (after a year of use), the urge for nicotine returned.",positive
"Easy to apply, combination of retinol and antibiotic.  Treated acne and an anti-aging treatment too.  The gel is odorless and goes on easily.  It is also non-greasy which is important if you have combination or oily skin.",positive
The benefits are that it does take away night sweats and hot flashes.,positive
"After trying Celexa for several months this drug finally made a difference with my anxiety and obsessive compulsive personality disorder. I noticed considerable change after using for 3-4 weeks. I am much more tolerant of things being ""out of control"" and have stopped some of my ""patterns"".",positive
"I was not able to ascertain any benefits from being treated with this medication.  Its purpose was pain relief, and I did not experience any alleviation of my pain.",negative
I have slightly high blood pressure on the diastolic side. Lotrel did a good job at maintaining good levels without increasing my pulse which I experienced with other BP meds.,positive
Viagra did help me in acheiving an erection after prostrate surgery. Other methods that were offered were not as attractive at the 3 times daily dosage of Viagra.,negative
"While taking this method of birth control, my period only came once every three months. It was much lighter than before and only lasted 3 days instead of 6, which was normal before. I didn't experience any bloating. It's a very cost-effective method compared to three-month supply of normal 28 day cycle pills.",positive
"decreased appetite, help to stop abusing alcohol",positive
I didn't take the product long enough to evaluate the benefits. I quit because of side effects.,negative
