benefitsReview,binary_sentiment
"The benefits were numerous, I don't have panic attcks for the first time in 20 yrs, and if I do, they are less than 20 seconds.  I haven't had a mixed state or very rapid cycling since getting on it 2 years ago.  These symptoms continued to get more severe until I got on this drug.  Every episode was worse and lasted longer.  This drug gave me my life back.  I lost my job(s) and wound up in psychiatric inpatient care.  But I have become steadily better since first taking the drug.  I have to admit, to get to the point I'm at now took 2 years, but it's better then I was, and it's better than not getting better at all.  The longer I'm on Seroquel, the better I feel.  Also, I am able to sleep because of Seroquel.  At the worst when I went into the hospital I couldn't sleep at all which was making my episode even worse.  Sleeping drugs and benzodiazepines such as valium that were given to me made me feel horrible, very tired the next day, and even made me panic.  Anticonvulsants and even other psychotics gave me panic attacks, made me antsy or made me so tired I couldn't even function in day to day life.  Seroquel doesn't make me real tired, but it  has made a sleep schedule possible again.  I also don't feel too tired in the morning.",positive
It did lower my BP some,positive
"After a few weeks my skin started to clear up and look my younger and clearer.  I did experience some tightening in my skin and dryness.  Also, I was instructed not to apply any moisturizer to my t-zone since that is my problem ares.",positive
"If I have a classical migraine, I cannot function without taking an Imitrex. Imitrex takes the edge off the pain, takes away the feeling of nausea and I am able to work on the computer, which I otherwise could not do with a migraine. The pills work most of the time but do not work if the headache was not a migraine. The drug used to have an effect quicker on me several years ago when it took care of my migraine within 30 minutes. Today it often takes me an hour to feel better after taking Imitrex.",positive
"completely relieved acid reflux and eliminated all symptons such as heartburn, cough, etc.
completely relieved acid reflux and eliminated all symptons such as heartburn, cough, etc.
completely relieved acid reflux and eliminated all symptons such as heartburn, cough, etc.",positive
"No benefits whatsoever, no change in bone density. I took one tablet on the same day each week with plenty of water first thing in the morning and stood upright for the next two hours as I prepared for work. The side effects were numerous and severe, and with continued use compounded themselves to the point that I feared I may not survive the year. My physician at the time refused to believe me and insisted that I continue taking the drug. I began intense research on my own and discovered I was not alone, and would have to make every attempt to save myself.",negative
"full long lasting erection up to two days after 20mg dosage,plus it works when you are ready, i must say it brings you back to your youth.",positive
Helped me easily get a good sleep. Possible reduction in IBS symptoms.,negative
Slowed the hair loss and thickened the hair somewhat...pretty good I thought !,positive
"I didn't notice dramatic results with this product and it was fairly expensive at $100 for one tube. I wasn't religious about applying it each day, so that might have had an impact on the effectiveness. I didn't notice significant fading of the darkest large freckles on my face as I had hoped. I didn't notice any significant reduction in wrinkles.",positive
"After the administration of the first injection the pain decreased, however after a period of two weeks it returned. A second injection was administered. There was no improvement and undesirable side effects, as described below, appeared.",negative
After taking the Zyban for 3 weeks my desire to smoke was nearly eliminated. I had tried other methods to quit smoking and this one actually worked! Unfortunately I had a severe allergic reactions to the medication (the main ingredient Wellbutrin).,negative
"Early this year I started noticing my skin around the eye beginning to lose its firmness: wrinkles formed during sleep could not be smoothed out by using Lancome eye cream.  Though, applying a collagen eye product does tighten up the eyelids, but only on the surface, and causing the skin around the eye to crack following facial motions.  I was very self conscious about the wrinkles. After using Renova (I've been using it for about two month now), the wrinkles are smoothed, and where the skin easily wrinkles is firmed up, supple and elastic.",positive
Reduced blood pressure and stopped cholestrol from forming in my arteries.,negative
"I have a long history in taking anti-depressant drugs.  It started in high school with prozac and desipramine, neither of which I have anything positive to report.  In college, after a dangerous stint without treatment, it resumed with luvox, and  later it was effexor.  Finally, after the scariest bout of all, leading to a stay in the hospital, they put me on wellbutrin.  Combined with rigorous therapy, dbt (dialectical behavioral therapy) groups, and much personal work, I got my head above water.  I was able to work, eat well and exercise regularly, but many of the symptoms were still there.  I thought that was the extent of what an anti-depressant could do for me, the rest of the work was up to me and maybe in about 20 years I might be able to feel happiness.  Since then I went off wellbutrin during a cross-country move, was part of a study for treatment resistant depression where it was recommended I try cymbalta.  I feel the cymbalta has actually influenced my negative thinking and given me more energy.  So now I know that an anti-depressant can potentially create better results than just keeping ones head above water.",positive
decreased ER visits due to control of the migraine at onset.  Lower stress level with the migraine due to medications quick action.,positive
None.,negative
none,negative
"not worth the cost of the side effects.  Becasue I was so miserable, I discontinued the medication early and opted for a more conventional anti-biotic.",negative
I stayed loose and limber throughout the day.  Didn't end up limping at the end of the day or after a 30 min car ride.  It made me feel like I was in my 30's again instead of my 50's.  It enables me to do yoga moves which I could not do because of the pain.  It's changed my life.  None of the side effects that narcotic pain relievers give.  No tiredness or spaciness,positive
"none, the sinus condition remained after a short trial of the Levaquin.  I had to resort to a regular Z-pak.",negative
improve cystic acne on chin -- I still get a few bumps but not as many or as violent as before the treatment.,positive
"Lowered his blood pressure with one pill to the point of passing out, and having severe cramping.",negative
None YET,positive
Skin cleared up immediately - the first time.,negative
the treatments benifits are to reduce acid reflux and stop acid from forming in the stomach.,positive
I am able to breath more easily. Taking the medication keeps my airways open and keeps me alive.,positive
Mega-dosage of Valtrex upon the first symptoms and signs of a cold sore typically effectively reduced and or eliminated the actual appearance and break out of cold sores.,positive
Zithromax quickly improved my bacterial sinus infection and allowed me to keep my travel plans for day 2 of treatment.  It worked amazingly fast in alleviating my symptoms.,positive
"Calmed Anxiety - Was having 4-6 anxiety attacks daily. Helped to stabilize my mood.
Slept at least 7 hours - Initially was started on sleeping pills. Would wake up around 5 times a night. With the Seroquel I only wake up a couple times a night.",positive
Taking the medicine was only once a day at the time I chose to take it. It helped me most during stressed situations of any size. I could handle anything and not get angry.,positive
It exfoliated my skin.,positive
"my experience with zyprexa has been very positive. it really saved my life.
i am able to think very clearly now.",positive
"Most say it takes 6 weeks for this drug to really be in your system. After taking for 3 days I could feel the effects, I was much calmer and able to handle stressful situations, and back to myself. My problem was that small daily stresses tended to become much larger than they should have. I am now much more able to let small things roll off my back.",positive
Reduction of oral prednisone and prednisone eyedrops w/ eventual stoppage. Uveitis cleared. Inflammatory arthritis is ongoing. I am undergoing new treatment with MTX currently.,positive
"I do feel much more awake, but I still need a nap everyday even after taking both of my doses. With 8-10 hours of sleep I'm still very fatigued, but I am able to think more clearly...and even drive again. My mood is much better and seems to be more stable than before. The endless fatigue used to spin me out of control and send me into rage, and the only way that I could deal with the rage was to clean like mad crazy and put my focus on ANYTHING other than the real issues...all the while never eating or drinking anything for weeks at a time. From there I would become extremely manic and focus only on organization, my eating disorder and cleaning. This hasn't happened at all since taking provigal in combination with Cymbalta. I did read that this medication is not recommended for people with a history of mania, ocd or eating disorders....but I feel that it's been very effective in the long run for me.",positive
"My hair had been falling out, and it finally stopped after taking this for a while.  Now it is growing back and getting thicker.  Before I was always cold and my hands would even get numb from being so cold all the time.  Now I am finally warm and don't have to wear a sweater  in the summer.",positive
"Completely eliminated neck pain. Interestingly, did not reduce slight-to-moderate left hip pain (see article on pain in 11/09 issue of Scientific American)",positive
"I don't have to worry about forgetting to take a pill or a condom breaking.  I have had no vaginal dryness,my sex drive is still the same (high), no cramping, matter of fact, I was cramping very badly the day that I started the ring and within an hour of insertion, my cramps went away.  I actually had blood clots before I started the ring, and now my periods are so much more lighter so I am not clotting at all. :)  Also, my period duration has been cut in half from 5-7 days to 3 or 3.5 days.  I think it's AWESOME!!  My partner does not feel it at all and we have it enthusiastically (vigorously)!",positive
cleared head and sinsus,positive
Relieved Gerd symptoms.,negative
"almost complete elimination of gerd symptoms--reflux,heartburn,nausea,choking spasms, cough.  I have also been able to eat a wider variety of foods without discomfort.",positive
"Increase in energy, immediate weight loss.",positive
"better outlook on life in general, less anxious, easier to deal with everything, a difference of night and day",positive
I used this cream very religiously. I was very particular about avoiding sun which is a must with thos medication.. I have to say that I have gotten rid of my pigmentation. My skin is very smooth and it also takes cate of ocassional breakout. My pore size has become smaller.,positive
"The pain in my back and neck caused stress and spasms. The medication relived the pain , nearly completlly, and allowed the spasms to subside. I tried anti inflamatories before for this re occuring problem and found them to be nearly useless. Strong pain killers like darvocet and vicadin are affective but do not allow me to maintain any normal activity during the drug use.",positive
"Apparently prevented wound infection, though efficacy of drug is questionable and causality cannot be established.",negative
"Nocturnal myoclonus (similar to restless leg syndrome) causes severe jerking of the legs every 15 seconds for up to 7 hours. Lisinopril allowed both myself and my partner to sleep at night. Somehow, the drug works without the adverse effects the other sleeping pills, neuro transmiter pills and anti-depressants had.",positive
"Singulair appeared to help somewhat with being able to breathe better.
Rhinitis was decreased.  It helped me miss fewer work days, especially when air index quality was poor.",positive
The medicine did help with the pain.,negative
"I have increased energy while taking this medication. It has possibly prevented osteoporosis. My family is quite prone to this, and my bone density tests only show slight osteopenia.",positive
Blood sugar levels returned to within normal limits.  The risk of having to become insulin dependent for my diabetes was decreased.,positive
only 4 periods a year,negative
I haven't noticed any benefits,negative
"Very effective in treating wrinkles by relaxing muscles - highly recommend by trained professional.  No down time, immediate results.  Very pleased with the outcome.",positive
Increased interest and enthusiasm in activities.,positive
"Since using the Retin-A along with the Accutane, I have noticed a great improvement in the look of my skin.  There are less clogged pores and it definitely more smooth and even in skin tone.  Any fine lines around my mouth and on my forehead have diminished but it hasn't helped much with fine lines around my eyes.",positive
"I noticed at first with the 150mg a boost in energy, and more regular sleeping habits. At the 300mg upgrade shortly into month two I went from smoking a pack a day (25 cigarettes) to about 3. My boyfriend smokes also which is why I still have a few a day. Also after smoking pot it's nice to have a smoke I find.",positive
sleep,negative
"Addition of neurontin reduced overall pain severity at the neuropathic injury site (R cervical spine), and appeared to lessen a qualitatively different component of the pain to that helped by tramadol. Combination of tramadol and neurontin in carefully tested comination (to suit patient) brought best pain result to date (injury 26mo prior).",positive
"For the first time in years I woke up without widespread flu like pain throughout my body. I woke up feeling rested, awake, alert. Some days were still worse than others, but overall a dramatic difference. I could function throughout the day, wasn't almost falling asleep all the time. If work got crazy and I had to pull 14-16 hrs - which was quite frequent - I didn't get immediately sick.  I actually flew on planes multiple times without getting sick. I used to blink and get sick because my system was so run down despite many hours of sleep a night. When I take xyrem I need only 6-8 hours of sleep and I would wake up and feel great throughout the day. It was an absolute lifesaver for me.",positive
"reduction of asthma symptoms and severity, less shortness of breath and light headedness",negative
"Quick relief of hypertension, moving from 150/120 area down to 130/80 region.",positive
significant decrease to nerve pain to arm,positive
It worked great! I would not be nauseated at all and could eat and have energy all day.,positive
Fter going back to the doctors for a nother swob the bacterial number was back to normal,positive
lowered blood pressure to within normal limits,positive
"Aided in decreasing symptoms of depression, and also reduced craving for cigarettes as a bonus.  Noticeably less lethargy.",positive
Benefits: Patch applied 1x weekly assured consistent delivery of dosage. No skin irritation reported by patient but recommended that site used be rotated weekly. Patch can come off if not applied correctly to clean dry skin - no lotions or creams s/b present. May not be metabolized through liver as much as oral estrogen - advantage.,positive
reduced blood pressure to within acceptable limits. replaced previous drug (ACE inhibitor) with undesirable side effects.,positive
cleared acne rosacea.,positive
Slight initial improvement of viral aggravated asthma.,negative
helped me sleep well,positive
Absolutely none,negative
"First of all there are a TON of competitors like rogaine on these reviews bashing propecia, how can you only take it for 3 months and have side effects that have ruined your life, i find that highly unlikely. Second, propecia does work even for a receding hairline, if u think your going to regrow your childhood hairline 99% of the time you won't. I have managed to keep my hair and regrow the thin parts and it just feels a lot better. and of course if you take a hormone blocking drug your gonna have sides but they are not bad at all i can still get a boner in about 10 seconds and its not limp. it didnt start really regrowing until about 6-7 months in so u gotta give it time.",positive
"improved range of motion, pain relief and decreased soreness",positive
"When I apply this cream on the infected area, It sometimes relives the pain in few seconds, or few mins. It is a symtomatic temporary relief. But the allergy repeats itself few months later.",positive
I was taking Flexeril for muscle inflammation in my ribs caused by sever coughing from bronchitis.  It helped with the pain a lot and helped me sleep through the night.,positive
The treatments stopped my monthly acne breakouts.  This allowed my skin to heal and broke the breakout cycle.  My skin has not wrinkled as fast as my friends of the same age.,positive
"Compared with synthroid that was prescribed to me in the beginning, I have fewer problems, like mood swings, sweating, weight gain, etc.",positive
It relieved the actual pain of my inflammed stricture,positive
"Synthroid aggravated my hives, tremendously.",negative
"The pain was definitely reduced, from high discomfort to relatively low discomfort, so long as I wasn't moving. It also helped me to sleep some of the time.",negative
This cleared up severe cracking and bleeding on hand. I have managed to avoid the condition for many months due to proper moisturization.,positive
"Amoxicillin did little, if any, good for the infection I had with my abcessed tooth. I also had a skin lesion caused by a bacteria, per the doctor, but Amoxicillin did not effect this at all. It stayed the same through the days I took this antibiotic.",negative
"Able to move easier, not in as much pain, more energy, sleeping better, mood is stable.",positive
infection cleared up in a week,negative
"Took 25mg for insomnia for about 3 weeks. Did not notice a difference. The Doctor Prescribed 50mg, and still no difference. Finally, I was prescribed 75mg and have been taking that dosage for about 2 months.I do sleep a little better than before, but I still do not sleep through the whole night.",negative
"Acne significantly reduced or disappeared, but returns immediately upon stopping treatment.",positive
The treatment benefits were very minimal because of the severe rage that I experienced. I don't think I benefited at all from taking this drug.,negative
I feel better about myself and less anxious and depressed.,positive
the benefit was a lowering of blood sugar and metformin does that very well without leading to hypoglycemia which can happen with some of the other anti-hyperglycemic drugs.,positive
"no watery itchy eyes, no runny stuffy nose. no sneezing. Normally my eyes are sticky and itchy and I sneez unconrtoallably. Also y nose woudl get completely stuffy and drip water constantly.",positive
"The prednisone immediately reduced the warmth and burning heat of the rash, although the rash continued to spread across my face for several days. It also stopped the itching. As another benefit, the prednisone also got rid of my eczema and--most thrilling--my tennis elbow, which was lingering from 9 months earlier!",positive
"I feel much more stabilized on this drug. However the 200 mg.did quit working after about year and a half, and I was hospitalized with a mixed episode. My Lamictal was raised to 400 mg. 200 at night and 200 in the AM. I am told this is the highest theraputic level for this drug for treating bi-polar. I am much more even but am also still on Geodon and kolonpin once a day. I am weaning off of zoloft-am at 50 mg. once a day at moment. I feel the real med that has helped is the Lamictal, I hope to wean off the rest of meds after being stable for a length of time.",positive
"Incredibly beneficial! By using the semi-synthetic opioid dreug along with a homeopathic, long used in europe product, Traumeel (HEEL, Inc.) my osteoarthistis and other spinal pain issues were substanially relieved on a 24 hr basis.",positive
Seasonique was great for me as a birth control method instead of condoms and I experienced no spotting or bleeding the whole 3 months before my period.,positive
this medication allowed patient to reduce other cholesterol lowering medications while still keeping high cholesterol under control,positive
I could fall asleep and was usually well rested.,positive
"I was finally able to get the deep sleep that I needed to function. Other problems that I have- Interstitial Cystitis, Fibromyalgia, Insomnia, etc.- seem to be improving because of the sleep that I am getting.",positive
It reduced my acne considerably. It provided a very smooth feeling to my skin that I did not experience with anything prior to using this medicine. It also gave me a rosier complexion with a glow.,positive
I had several episodes of extremely high blood pressure 212/90 was one reading.  It was mainly a product of work related stress and being overweight.  First I was treated with Prozac for the depression/anxiety and became suicidal.  With the Paxil and Lisinopril combination my blood pressure is controlled and I do not suffer from depression nor anxiety.  I respond to outside stimuli in a more normal way.,positive
Absolutely none. This drug destroyed my marriage. I was so irrationally angry over really stupid stuff. I was raging at my husband for no reason. And it made our marriage crazy to the point that we separated and divorced. I have been told this drug does cause anger in perfectly normal people and that it is like being on speed or cocaine. I would pull this drug from the market.,negative
My anger and depression seemed to get much better within 3 weeks of starting on 75 mg. My dose was eventually increased over time to 150mg.  My family noticed a difference in my attitude.,positive
"Before taking Prozac I had no energy or joy - I could barely lift my head off the pillow in the morning. I just wanted to stay in bed. When I first started taking it, I could feel it physically - I felt a little ""giddy"" and my eyes felt/looked glazed. But over time, those feelings went away and I just felt normal. I no longer felt like I was on a drug - I just felt good. I could get up in the morning and looked forward to each day.",positive
depression reduced - I had taken it at a lower dosage at first - but his had no effect - at all - so psychiatrist had to prescribe a higher dosage than the family doctors are allowed...the effect was amazing - I suddenly felt a 100% better after  a week or so - I had been on the lower dosage for months with no effect.,positive
So far I've been sad to say the the side effects are worse for him. I want to continue the drug longer to hope that the side effects will decrease.,negative
"It was able to supress my hunger enough to ""get through"" the tough times and not be so grumpy about it :)  Simply, I was not STARVING all the time, and it made the weight loss bearable.  It was not EASY, but it gave me the drive to keep going because I wasn't so miserable while doing it. I ate a 1200 calorie a day or less diet and exercised many times a week...so I would have lost weight anyway, but it just made it easier.",positive
Infection gone.,positive
This product reduced the severity of the breakouts and reduced length of time of the acne outbreak.  It was effective in reducing the outbreak but it does not eliminate or reduce blackheads unless an inordinate amount of ointment is applied daily.,positive
"This medication is manufactured to lower the bad cholesterol levels.
Therefore it is produced to dicrease the risk of heart attack and stroke. After first month of usage the blood test should be performed . The dosage shall be adjusted accordingly and another three months treatment shall follow before another bloood test is done.",positive
"The side affects were not so bad. The pills were easy to take, and got them from Publix so they were vanilla flavored.",positive
The benefits are numerous. With the Geodon I haven't suffered from a bout of depression in app. 2 1/2 yrs.. Before the Geodon I suffered from depression for months at a time. I haven't been or felt suicidal at all since beginning the drug. With Geodon I am on an even keel. By that I mean that I do not suffer from the peaks and valleys of typical bi-polar disorder. I no longer have manic episodes for days and then sink into a dark depression. It has made most of my bi-polar traits go away.,positive
"Catapres was initially effective at reducing my blood pressure on it's own, but there was reduced effectiveness over time. For this reason I began taking Betaloc in addition to catapres (daily). Taking these two drugs together has resulted in good blood pressure control with a fairly low dose of each drug.

A side benefit of taking catapres has been that it helps to control my Rosacea symptoms. I have had the reason for this explained to me, but cannot recal the details (has something to do with Catapres effect on the sympathetic nervous system).",positive
